{
  "period": "2026-09",
  "generated_at": "2026-10-10T18:15:33.895306",
  "currency": "MYR",
  "rows": [
    {
      "row_id": "LED-0001",
      "direction": "out",
      "category": "COGS",
      "description": "Raw coffee beans 1kg x 50",
      "quantity": 50,
      "unit_price": 25.0,
      "amount": 1250.0,
      "tax_amount": 75.0,
      "amount_incl_tax": 1325.0,
      "source_ref": "docs/INV-2026-0941.pdf",
      "document_type": "invoice",
      "document_number": "INV-2026-0941",
      "document_date": "2026-09-05",
      "vendor_name": "Syarikat Bekal Sdn Bhd",
      "confidence": 0.95,
      "reconciled": true,
      "reconciled_with": "docs/RCP-2026-0941.pdf",
      "flags": []
    },
    {
      "row_id": "LED-0002",
      "direction": "out",
      "category": "SUPPLIES",
      "description": "Paper cups 500pcs",
      "quantity": 10,
      "unit_price": 45.0,
      "amount": 450.0,
      "tax_amount": 27.0,
      "amount_incl_tax": 477.0,
      "source_ref": "docs/INV-2026-0941.pdf",
      "document_type": "invoice",
      "document_number": "INV-2026-0941",
      "document_date": "2026-09-05",
      "vendor_name": "Syarikat Bekal Sdn Bhd",
      "confidence": 0.95,
      "reconciled": true,
      "reconciled_with": "docs/RCP-2026-0941.pdf",
      "flags": []
    },
    {
      "row_id": "LED-0003",
      "direction": "out",
      "category": "COGS",
      "description": "Raw coffee beans 1kg x 50",
      "quantity": 50,
      "unit_price": 25.0,
      "amount": 1250.0,
      "tax_amount": 75.0,
      "amount_incl_tax": 1325.0,
      "source_ref": "docs/INV-2026-0941-copy.jpg",
      "document_type": "invoice",
      "document_number": "INV-2026-0941",
      "document_date": "2026-09-05",
      "vendor_name": "Syarikat Bekal Sdn Bhd",
      "confidence": 0.8,
      "reconciled": true,
      "reconciled_with": "docs/RCP-2026-0941.pdf",
      "flags": [
        "blurry_image",
        "duplicate"
      ]
    },
    {
      "row_id": "LED-0004",
      "direction": "out",
      "category": "SUPPLIES",
      "description": "Paper cups 500pcs",
      "quantity": 10,
      "unit_price": 45.0,
      "amount": 450.0,
      "tax_amount": 27.0,
      "amount_incl_tax": 477.0,
      "source_ref": "docs/INV-2026-0941-copy.jpg",
      "document_type": "invoice",
      "document_number": "INV-2026-0941",
      "document_date": "2026-09-05",
      "vendor_name": "Syarikat Bekal Sdn Bhd",
      "confidence": 0.8,
      "reconciled": true,
      "reconciled_with": "docs/RCP-2026-0941.pdf",
      "flags": [
        "blurry_image",
        "duplicate"
      ]
    },
    {
      "row_id": "LED-0005",
      "direction": "out",
      "category": "UTIL",
      "description": "Electricity consumption Sep 2026",
      "quantity": 1,
      "unit_price": 485.3,
      "amount": 485.3,
      "tax_amount": 29.12,
      "amount_incl_tax": 514.42,
      "source_ref": "docs/TNB-SEP-2026.pdf",
      "document_type": "invoice",
      "document_number": "TNB-SEP-2026-8821",
      "document_date": "2026-09-15",
      "vendor_name": "TNB Tenaga Nasional",
      "confidence": 0.91,
      "reconciled": true,
      "reconciled_with": "docs/TNB-PAY-SEP.pdf",
      "flags": [
        "no_po_reference",
        "escalate_missing_po"
      ]
    },
    {
      "row_id": "LED-0006",
      "direction": "out",
      "category": "SUPPLIES",
      "description": "A4 paper ream 500 sheets",
      "quantity": 20,
      "unit_price": 12.5,
      "amount": 250.0,
      "tax_amount": 15.0,
      "amount_incl_tax": 265.0,
      "source_ref": "docs/KAT-2026-077.pdf",
      "document_type": "invoice",
      "document_number": "KAT-2026-077",
      "document_date": "2026-09-18",
      "vendor_name": "Kedai Alat Tulis Maju",
      "confidence": 0.93,
      "reconciled": false,
      "reconciled_with": null,
      "flags": []
    },
    {
      "row_id": "LED-0007",
      "direction": "out",
      "category": "SUPPLIES",
      "description": "Ballpoint pens blue box of 50",
      "quantity": 5,
      "unit_price": 35.0,
      "amount": 175.0,
      "tax_amount": 10.5,
      "amount_incl_tax": 185.5,
      "source_ref": "docs/KAT-2026-077.pdf",
      "document_type": "invoice",
      "document_number": "KAT-2026-077",
      "document_date": "2026-09-18",
      "vendor_name": "Kedai Alat Tulis Maju",
      "confidence": 0.93,
      "reconciled": false,
      "reconciled_with": null,
      "flags": []
    },
    {
      "row_id": "LED-0008",
      "direction": "out",
      "category": "MAINT",
      "description": "Espresso machine service and descale",
      "quantity": 1,
      "unit_price": 350.0,
      "amount": 350.0,
      "tax_amount": 28.0,
      "amount_incl_tax": 378.0,
      "source_ref": "docs/ST-2026-088.jpg",
      "document_type": "invoice",
      "document_number": "ST-2026-088",
      "document_date": "2026-09-22",
      "vendor_name": "Syarikat Servis Teknik",
      "confidence": 0.48,
      "reconciled": false,
      "reconciled_with": null,
      "flags": [
        "blurry_image",
        "handwritten"
      ]
    },
    {
      "row_id": "LED-0009",
      "direction": "out",
      "category": "MAINT",
      "description": "Replacement gasket set",
      "quantity": 2,
      "unit_price": 45.0,
      "amount": 90.0,
      "tax_amount": 7.2,
      "amount_incl_tax": 97.2,
      "source_ref": "docs/ST-2026-088.jpg",
      "document_type": "invoice",
      "document_number": "ST-2026-088",
      "document_date": "2026-09-22",
      "vendor_name": "Syarikat Servis Teknik",
      "confidence": 0.48,
      "reconciled": false,
      "reconciled_with": null,
      "flags": [
        "blurry_image",
        "handwritten"
      ]
    },
    {
      "row_id": "LED-0010",
      "direction": "out",
      "category": "TRANSPORT",
      "description": "Delivery fees week 38",
      "quantity": 1,
      "unit_price": 180.0,
      "amount": 180.0,
      "tax_amount": 10.8,
      "amount_incl_tax": 190.8,
      "source_ref": "docs/GRAB-WEEKLY-0938.pdf",
      "document_type": "invoice",
      "document_number": "GRAB-WEEKLY-0938",
      "document_date": "2026-09-28",
      "vendor_name": "Grab Food Delivery",
      "confidence": 0.95,
      "reconciled": false,
      "reconciled_with": null,
      "flags": [
        "no_po_reference"
      ]
    },
    {
      "row_id": "LED-0011",
      "direction": "out",
      "category": "MARKETING",
      "description": "Facebook ad campaign September",
      "quantity": 1,
      "unit_price": 600.0,
      "amount": 600.0,
      "tax_amount": 48.0,
      "amount_incl_tax": 648.0,
      "source_ref": "docs/PD-2026-055.pdf",
      "document_type": "invoice",
      "document_number": "PD-2026-055",
      "document_date": "2026-09-10",
      "vendor_name": "Pemasaran Digital Sdn Bhd",
      "confidence": 0.92,
      "reconciled": false,
      "reconciled_with": null,
      "flags": []
    },
    {
      "row_id": "LED-0012",
      "direction": "out",
      "category": "MARKETING",
      "description": "Flyer printing 2000pcs",
      "quantity": 2000,
      "unit_price": 0.5,
      "amount": 1000.0,
      "tax_amount": 50.0,
      "amount_incl_tax": 1050.0,
      "source_ref": "docs/PD-2026-055.pdf",
      "document_type": "invoice",
      "document_number": "PD-2026-055",
      "document_date": "2026-09-10",
      "vendor_name": "Pemasaran Digital Sdn Bhd",
      "confidence": 0.92,
      "reconciled": false,
      "reconciled_with": null,
      "flags": []
    },
    {
      "row_id": "LED-0013",
      "direction": "in",
      "category": "MISC",
      "description": "Sales income — Walk-in customer",
      "quantity": null,
      "unit_price": null,
      "amount": 850.0,
      "tax_amount": 0,
      "amount_incl_tax": 850.0,
      "source_ref": "docs/SALES-2026-09-20.jpg",
      "document_type": "receipt",
      "document_number": "SALES-2026-09-20",
      "document_date": "2026-09-20",
      "vendor_name": "Walk-in customer",
      "confidence": 0.8,
      "reconciled": false,
      "reconciled_with": null,
      "flags": []
    }
  ],
  "summary": {
    "total_in": 850.0,
    "total_out": 4830.3,
    "total_tax": 300.62,
    "net_cash_flow": -4280.92,
    "by_category": [
      {
        "category": "COGS",
        "total_amount": 1250.0,
        "total_tax": 75.0,
        "row_count": 1
      },
      {
        "category": "UTIL",
        "total_amount": 485.3,
        "total_tax": 29.12,
        "row_count": 1
      },
      {
        "category": "SUPPLIES",
        "total_amount": 875.0,
        "total_tax": 52.5,
        "row_count": 3
      },
      {
        "category": "MARKETING",
        "total_amount": 1600.0,
        "total_tax": 98.0,
        "row_count": 2
      },
      {
        "category": "MAINT",
        "total_amount": 440.0,
        "total_tax": 35.2,
        "row_count": 2
      },
      {
        "category": "TRANSPORT",
        "total_amount": 180.0,
        "total_tax": 10.8,
        "row_count": 1
      },
      {
        "category": "MISC",
        "total_amount": 850.0,
        "total_tax": 0,
        "row_count": 1
      }
    ],
    "reconciliation_rate": 0.3,
    "document_count": 12,
    "flagged_row_count": 6
  }
}